"89","CoLab","10.4548808","7.405692799999997","kaduna South, Kaduna, Nigeria","Kaduna","Kaduna","Nigeria","CoLabs is a co-creation space, incubator/accelerator and an innovation space that focuses on skill acquisition, social impact and innovation. "
"90","Tribe","6.2757656","7.006839300000024","Anambra, Nigeria","","Anambra","Nigeria","Tribe is an innovation centre that is focuses on skill acquisition, social impact and innovation.  "
"91","Passion Incubator","6.452403899999999","3.39685350000002","Lagos Island, Lagos, Nigeria","Lagos","Lagos","Nigeria","Passion Incubator is an innovation hub that focuses on job creation, skill acquisition and innovation. "
"92","Wired Startups","31.791702","-7.092620000000011","Morocco","","","Morocco","Wired Startups is an Incubator/Accelerator that is focused on job creation, skill acquisition and innovation."
"93","Olotu Square","4.815553999999999","7.049844200000052","Port Harcourt, Nigeria","Port Harcourt","Rivers","Nigeria","Olotu Square is an innovation center focused on social impact, youth engagement and innovation. "
"94","Injini","-33.9248685","18.424055299999964","Cape Town, South Africa","Cape Town","Western Cape","South Africa","Injini is an incubator and accelerator that is focused on social impact, job creation and innovation. "
"95","Shinga Entrepreneurship and Learning Hub","-17.8330168","31.085587900000064","Mutare Road, Harare, Zimbabwe","Harare","Harare Province","Zimbabwe","Shinga Hub is a coworking space that is focused on job creation, skill acquisition and innovation"
"96","Civic Foundation for Innovation","9.0764785","7.398574000000053","Abuja, Nigeria","Abuja","Federal Capital Territory","Nigeria","Civic Innovation hub is a co-creation space and innovation center that is focused on social impact, youth engagement and innovation. "
"97","Kianda Hub","-8.824925499999997","13.227983300000005","ANGOLA LNG, Rua Amílcar Cabral, Luanda, Angola","Luanda","Luanda","Angola","Kianda Hub is an open space, coworking, co creation space and innovation center that focuses on social impact, job creation and innovation. "
"98","Iris Hub","-1.9705786","30.10442880000005","Kigali, Rwanda","Kigali","Kigali City","Rwanda","Iris Hub is an incubator and accelerator focused on job creation, youth engagement and innovation. "
"99","Kivu Hub","-4.391989299999999","15.31278240000006","Bukavu, Kinshasa, Congo-Kinshasa","Kinshasa","Kinshasa","Democratic Republic of the Congo","Kivu Hub is an incubator and accelerator that are focused on social impact, job creation and innovation. "
"100","Honode Hub","6.2330852","0.9965617000000293","Ho - Denu Road, Dzodze, Ghana","Dzodze","Volta Region","Ghana","Honode Hub is an incubator and accelerator  that are focused on skill acquisition, job creation and innovation.  "
"101","Incubme Algeria","28.033886","1.659626000000003","Algeria","","","Algeria","Incubme is an incubator and accelerator  that are focused on skill acquisition, job creation and innovation."
"102","Diaspo Hub","12.6250651","-7.988217999999961","Ambassade d'Allemagne, Rue 14, Bamako, Mali","Bamako","District de Bamako","Mali","Diaspo Hub is an incubator and accelerator  that are focused on skill acquisition, social impact and innovation."
"103","iZone Hub","-17.8118106","31.08950290000007","Zimbabwe Cricket, Maiden Drive, Harare, Zimbabwe","Harare","Harare Province","Zimbabwe","iZone Hub is an incubator and accelerator that are focused on skill acquisition, job creation and innovation."
"104","Altoufikh International","12.1348457","15.055741500000067","N'Djamena, Chad","N'Djamena","N'Djamena","Chad","Altoufikh International is an open space focused on social impact, youth engagement and innovation. "
